{"$id":"https://hiri-protocol.org/resources/preview/rhp-2026-07/schemas/runtime-config/v1","$schema":"https://json-schema.org/draft/2020-12/schema","additionalProperties":false,"properties":{"artifactResolverOrigins":{"maxItems":0,"type":"array"},"canonicalOrigin":{"const":"https://hiri-protocol.org"},"capabilityEvidence":{"additionalProperties":false,"properties":{"notAfter":{"pattern":"^[0-9]{4}-(?:0[1-9]|1[0-2])-(?:0[1-9]|[12][0-9]|3[01])T(?:[01][0-9]|2[0-3]):[0-5][0-9]:[0-5][0-9]Z$","type":"string"},"sha256":{"pattern":"^sha256:(?!([0-9a-f])\\1{63}$)[0-9a-f]{64}$","type":"string"}},"required":["sha256","notAfter"],"type":"object"},"identityAnchorSetVersion":{"pattern":"^[a-z0-9][a-z0-9._-]{0,127}$","type":"string"},"issuerAuthoritativeCurrentHeadOrigins":{"maxItems":0,"type":"array"},"policyVersion":{"pattern":"^[a-z0-9][a-z0-9._-]{0,127}$","type":"string"},"presentationDeliveryOrigins":{"maxItems":0,"type":"array"},"releaseId":{"const":"real-holder-preview"},"remoteResourceOrigins":{"maxItems":0,"type":"array"},"resourceManifestSha256":{"pattern":"^sha256:(?!([0-9a-f])\\1{63}$)[0-9a-f]{64}$","type":"string"},"schema":{"const":"hiri:real-holder-preview-runtime-config:v1"},"supportedCapabilities":{"items":{"enum":["authority-abandonment","disposable-holder-authority","ephemeral-self-assertions","local-clipboard-presentation-delivery","local-file-presentation-delivery","local-file-request-ingress","local-paste-request-ingress","persistent-self-assertions","presentation-signing","same-device-rotation"]},"maxItems":10,"minItems":1,"type":"array","uniqueItems":true}},"required":["schema","releaseId","canonicalOrigin","artifactResolverOrigins","issuerAuthoritativeCurrentHeadOrigins","remoteResourceOrigins","presentationDeliveryOrigins","resourceManifestSha256","identityAnchorSetVersion","policyVersion","supportedCapabilities","capabilityEvidence"],"title":"RHP public runtime configuration","type":"object"}